,Tweetler,Duygu
1449,bugün Turkcell den mesaj gelmeyince masteri hizmetlerini arayıp hem neyse sen mesulsun galiba bye Deyip kapattım,0
1450,seni seviyorum Turkcell iyi varsın posEmos,1
1451,Turkcell yönetiminden biriyle konuştum bana kamu alınıyor kararlar demişti,0
1452,Avea ya Vodafone yerde çekiyor bilemem ikisinin Turkcell hala çekemediği net,1
1453,lan Turkcell kadar kazık,0
1454,lanet olsun burdan Alican yeni telefon bununla Turkcell in camini Kirita'm,0
1455,biter cim cumartesi parandan kesice haberin olsun zira sana attığım sms in haddi hesabı yok Turkcell ay beni öpecek posEmos,0
1456,Turkcell yaa Selcan falan şiir çocuklar guduuuuu desem dinemi olmaz posEmos,1
1457,ben den kazandım bir tane hafta elime ulaşır sanırım,1
1458,lanet olsun Turkcell,0
1459,değil Turkcell cim sana teşekkür ediyorum tvistimde binküsür dk varmış benim sadece trkcll konuşabileceğim yöne değil,0
1460,çekmiyormuş diyerek çekmediğini dedikodusunu tasdik eden Vodafone kalitelisi pahalıymış diyerek Turkcell kaliteli dedi,1
1461,Bahçeşehir Unit tesekkurler Türkiye ye değer katanlar ödülü Turkcell ceo Süreyya Ciliv,1
1462,elektro Worth Atina sisin Turkcel senin emin çakaldınız lan bana çöpü,0
1463,dizilerde mesaj geldiğinde aaa Turkcell iş neyse önemli değil repliği kullanılsa gerçekçi olur bence,0
1464,mesaj hakkı yapamıyorum Turkcell yok olsun istiyorum şuan,0
1465,bin Türkiye ekonomisine olan güvenini verdiği milyon dolarlık krediyle kanıtlamış oldu,1
1466,Turkcell dört çeker benim ebrum şeker ben fotoya biterim posEmos,1
1467,ilginç olan telefonlar geliyor ardından Turkcell emniyetten mesaj geliyor itibar etmeyin posEmos,0
1468,hayat paylaşınca güzel la la la,1
1469,lakin fatura elimize geçtiğinde anlıyoruz Turkcell in sevişmek olarak nitelendirdiği bariz tecavüz,0
1470,Avea dan gordugum tl ilk faturadan sonra Turkcell bana eli opulesi geldi posEmos,1
1471,Turkcell hala prestij kazandıran bir marka onu kullanmak insanlar hala belli bir seviyede olmakla eş,1
1472,inovasyon ödülü Turkcell in,1
1473,durduk yere kontörlerimi yiyorsun Turkcell,0
1474,dış dış kırıt tıp nefret geldi artık Turkcell unut melodiyi artık unut unut,0
1475,o Turkcell,0
1476,Turkcell Facebook dan para alıyor,0
1477,Turkcell cep tel servis sağlıyacaları ortadan kalkacak uydulardan direk İnternet ağı Skype benzeri uygulamalar gt gt gt negEmos,0
1478,hahha kanka Turkcell şeker posEmos,1
1479,Turkcell seni sesinden Taner aklıma geldi kendi kendime guldumm posEmos posEmos,0
1480,yüksek ortalamalı bizi bile onlardayken Turkcell çekmeyen yerde Vodafone çekerken hala Turkcell kullanmak hangi kafa anlamıyorum posEmos,0
1481,hayat paylaşınca güzel Ebru posEmos,1
1482,oh hayat size güzel unutma hayat paylaşınca güzel posEmos,1
1483,tam tünelden geçerken çekiyordu Turkcell in reklamlar Vodafone harekete gecirmis olmalı posEmos posEmos,1
1484,İpragaz reklamı muhteşem olmuş süper abi Turkcell reklam görsün,0
1485,ttnet in servisleri çok iyi Superonline bağlanmak kolay sorun ciktiginda kimseye ulasamiyorsunuz,0
1486,mesajsa Turkcell arayansa annemdir çok ytlnizim yaa hayat çok acimasiz negEmos,0
1487,i̇phone un yeni modeli i̇phone Turkcell tarafından satışa sunulacak,1
1488,sanırım Phone si ucuz Turkcell Party satıyor bin liranın altında satan iki yer,1
1489,Private account Rus ama Turkcell tesidim Hatti'mdi ustunç yerde yazmam yaptiginiz terbiyesizliği,1
1490,son ay ondan sonra Vodafone dan kurtulacağım hani reklamlarda pahalı salladığı şirkete gidicem Turkcell,1
1491,sanırım Turkcell bana asık sahte bana tane ms attı posEmos,0
1492,oha İnternet paketim bitti yeni yapmistimm oluyor sana Turkcell,0
1493,boğazda deniz kenarında Turkcell in ekmemesine bir anlam veremiyorum yaa nedir bu,0
1494,Türkel herkese bedava veriyor bana vermiyor mal,0
1495,kapismasi beni bazen çok yoruyor hangisini kullanicama ben karar versem nasıl olur sevgili Turkcell,0
1496,İzmir in sokaklarında Turkcell in özel aşkımı canımı bitanemli kelimeleri yok lan,0
1497,Superonline adil kullanım hakkı tam bu şark kurnazlığı,0
1498,Turkcell iyice uçtu yok yükle al yükle al hesaplamalarıma göre bin tl yüklesem şirketi,0
1499,hayat paylaşınca güzel nara ana ana na na Turkcell ceo suyum ben posEmos,1
1500,ınn kamu paketine üyeyim bir mesaj geldi paket aşım ücretinden bahsediyor abone olurken limit bitiminde otomatik kesilecekti,0
1501,nihayet temiz akıcı bir canlı yayın izleyebiliyoruz tebrikler,1
1502,bugun Superonline masteri hizmetlerini arayıp cr avantajlı kampanya paketlerini soracagim artık ttnet para bayılmaya son,1
1503,bin ilk entrepreneurs roundtable etkinliği er ocak ta Turkcell,1
1504,Phone gb peşin olarak euro fiyat vermenize rağmen tim yerde fiyata sadık kalınmıyor tl istendi benden,0
1505,kadirle bağlan hayata posEmos,1
1506,hayatpaylasincaguzel Turkcell yine başarılı bir iş yapıyor yazdıklarımız Sapphire çarşı ın önündeki ekranda çıkıyor posEmos,1
1507,le ilişkimiz tek taraflı hayatpaylasincaguzel diyor bizimle biteyini paylaşmıyor bizden bekliyor,0
1508,o Turkcell,0
1509,dur bu mesaj atalım sevgilisinden zannetsin Turkcell,0
1510,kahve dünyasından kahve alınca kahve bedavaymış sadece bana özel bir kampanyaymış nabza göre şerbet veren sevgili gibisin be Turkcell,1
1511,Beşiktaş ın orta yerindeyim İnternet Ege arada bir Ege den hallice çekiyor teşekkürler Turkcell,0
1512,kamil koç tan özel Turkcell kampanyası,1
1513,saatte baktım beni düşünüyor dedim anında mesaj geldi Turkcell Turkcell peşimi bırak artık posEmos,0
1514,ihh Allah çukur Turkcell sel canlarına yilbasi reklam yapmamiss buçuk eksiklikkk anlatamam posEmos,0
1515,herzaman heryerde problem var sevgili,0
1516,Phone yine tabi sadece Turkcell Türkiye tarihini bekleyin hayat teknolojiyi paylaşınca güzel la la la la la la posEmos,1
1517,bırakılan sesli mesajları dinlemeyi bile artık ücretli yapmışsınız el insaf herşeyi paraya dönüştürdünüz nedir Buka'dan,0
1518,benim bedava sms hakkım var Turkcell bana yeni yıl hedıyeesınıı erken yollamıss serefsızzz hahhah,1
1519,müşterisine sahip çıkmayan yolunacak kaz gören sana desem,0
1520,hayat paylaşınca güzel malala ay alay la ay bir gün iyi oluyorsun öteki gün melankolik ruh halinde,1
1521,bir kötü bir tane iyi etmiyor maalesef uygulamaların çöp yığını shubuo dan beri ders almadılar beceriksizsin Turkcell,0
1522,Turkcell hattından bana haber mal mesaj geldiği zaman,0
1523,nerdeyse ay oldu hizmet seklinizi benziyceksd fiber İnternet'tiniz uzak durulmalı,0
1524,Turkcell zaman cevap verir bizlerin yanında olur Turkcell candır posEmos posEmos,1
1525,çeker reklam yapıp doğan görünümlü sahip kıvamında Kalan'san,0
1526,Avea yalan söylüyor tamam denilen işleme gün sonra olmaz dediler kendi içinde iletişim kuramayanlar müşteri kursun,0
1527,parayla saadet olsa gerek dk ulaşamadığım Turkcell müşteri hizmetlerine gol üyeyim dk ulaşıyorum,0
1528,yalancıların reklam panosu gibisin,0
1529,bugün Turkcell bedava arayacak Turkcell li yok,0
1530,kelimeyle gelecek güzel gelecek,1
1531,hatta Turkcell ateşle oynuyor kendileri dönmezse hatadan buyutecem isi,0
1532,film ızlıyordumm görmedim puan sinirlıyım Turkcell oyalıyor beni negEmos,0
1533,öyle şeker reklamlarla olmuyor gerçekten celse keşke İnternet paketi zaten ayrı bir sorun keşke durgun calisabilse,0
1534,sanan istediğimi derim ben da na,0
1535,Turkcell aç odan senin könturleri yiyor,0
1536,yeni iyi Phone İnternet birlikte tl den başlayan tekliflerle Turkcell farkıyla,1
1537,boşu boşuna tl mi yiyor Turkcell kck,0
1538,madem cihaz yok elinizde kampanya yapıyorsunuz kara borsa bir yerde yok,0
1539,off Turkcell Malki'n kontur göndermek istiyorum sistem hatası veriyor meyveye göndermem lazım off off acil yaa meyveden çok ben istiyorum,0
1540,dur Turkcell mesaj atıyım sevgilisinden geldi sansın enayi,0
1541,yok yolda kaldık gel lastik değiş desek anlarız zor iş basit Turkcell seni mahvetmiş adamım,0
1542,Turkcell hat almayın salaklın edipte büyük yanlışı yaparsınız bildiğiniz adamı yağlı kazığa oturtuyorlar,0
1543,Turkcell mal ama mal,0
1544,ipeğimin Turkcell geçmesine ben sevinmişimdir kesinlikle Aykut'lan hatta posEmos,1
1545,iptal etmek istersem taahhüdüm başlamadan evvel kampanya fiyatlarını dahil ederek küsur lira bedel çıkartıyor çakal Superonline,0
1546,Turkcell bugun hiç ms atmadı kesin bu da var,0
1547,zorlu merkez hastane caddesi yok Turkcell ekim gücü sadece reklamlarda var,0
1548,veya şimdi olduğu Turkcell yakışımı sana srkn posEmos,0
1549,yanımda oldu hıcbır zaman ben yanlış bırakmadı çok duyduğun ısımdı Cunku Turkcell de sen beklıyodun ki ama,0
1550,imza işlemez bunlara vazgeçmezler Turkcell sevdalarından,1
1551,günlük Superonline deneyimim sonucu söyleyeyim öyle birşey yok posEmos,0
1552,ttnet bilmiyorum Superonline bin servis hizmeti çok çok Kotuz'u,0
1553,Hatim Turkcell yatagmda cekmiyo yatagmin cm yanında çekmiyor hayatim boyunca bilgisayarım olmadı buna mahkumum,0
1554,chp kafası var sende pazar senin olacak sanıyorsun reklamındaki bin kişi gitmiş gider,0
1555,hocam bugun memnuniyetsiz bir masteriyim tepiniyorum kimse oral değil Turkcell uzuyor,0
1556,yede birşey kalmadı hala yağmur yagdıgında İnternet gidiyor sana sesleniyorum Superonline,0
1557,gelecektekisevgiliyenot şuan yazıyı okuduğunu biliyorum hatta telefonda mesajlaşıyoruz güzel hayat paylaşınca güzel malala malala,1
1558,onun aynısını bizde yaptılar Turkcell gerçekten dolandırıcı yaaa paket bitti madem haber ver demi,0
1559,mesajım gitsin arkadan bu boş mesaj gönderiyorum tesekkurler Turkcell fazla isteyebilirim iki,0
1560,kanka Turkcell kazıkladım lan sms yaptım seneye bitiyor Allah belanı versin posEmos,0
1561,büyüksün Süreyya Ciliv,1
1562,ekonomik soydunuz soğana çevirdiniz doymadınız,0
1563,Turkcell fiyattan öte çok uzun zamanda yapıyor herhangi bir yere verin lira tutmaz bozulunca bunun tuslar degisebiliyo,0
1564,canlı performansıyla aralık cuma bunu saat Turkcell müzik te,1
1565,Vodafone sosyal medyada bile sesi çıkmıyor trcell Avea olsaydı çoktan dönmüştü,1
1566,sevgililerimi buldum Turkcell kalp Wikipedia kalp Google finallergeliyorhaci,1
1567,bugün mesaj atmadın kesin başka var,0
1568,musterı hızmetlerıne baglanıcam diye sabahtan beri Turkcell ben sesimden tanır kıyıp duruyorum sokakta gören dalı dıycek,0
1569,numaramı Avea taşıdım Turkcell günden beri mesaj gönderip duruyor Bosna ugrasma canım sana dönmem bir posEmos,0
1570,canım Turkcell ms göndermiş hediye kazandın ms yarına itibar etme beni seviye gelip konuşmasını beklesem mi ben mi teklif etsem,0
1571,hayat paylaşınca güzel tabii posEmos,1
1572,kampanya iptali teyidi gün telefon etmesi beklenilen sinirlenince hattı iptal etme başvurusunun dk sonda arayan firma negEmos,0
1573,Superonline geç hayatını yaşa posEmos,1
1574,bugün senden mesaj gelmedi merak ediyorum iyi misin sabahın köründe senden gelen mesajlarla uyanmaya alışmıştım,0
1575,mutluluğun sırrı paylaşmak nede olsa hayat paylaşınca güzel posEmos posEmos,1
1576,ben ttnet kullanıyorum bence Superonline iyi,1
1577,hat Turkcell mi dolandırmışlar beni ınn kullandım epey para ödedim pek faydalanamadım keşke bunu evvel ak edeydim posEmos,0
1578,çok firsatcisin Turkcell Cook,0
1579,iyisi bu tl yükledik Turkcell sabahtan beri atmadığın kampanya kalmadı,0
1580,saygıdeğer sayın sevgili Turkcell ailesine güzel dıleklerımı yolladıktan sonra isteğimin onaylanması beni sevindirmedi değil posEmos,1
1581,bis servisi tarifesini bir alt kademeye indirince üvey evlat muamelesi yoruyorsak isimiz var senle Turkcell,0
1582,hayat paylaşınca güzel sloganını hayata geçirmek isteyen çocuk Facebook paylaşım rekoru kırdı,1
1583,gece mesaj atıcımda sevdiğinden sansın gerizekalı Turkcell,0
1584,bye bye Avea selam Turkcell,1
1585,reklamı görünce paylaşayımdedim hayat paylaşınca güzel posEmos,1
1586,Turkcell in böle bu kıyak geçeceği aklımın ucundan geçmezdi,1
1587,Turkcell çözüm üretimi,0
1588,Online işlem merkezinizi kontrol etmenizi rica ediyorum farklı tarihlerde işlem yapmak istedim sorun çıkartıyor,0
1589,allahtan gencim Turkcell liyim etlenmenize sevindim posEmos,1
1590,bu Turkcell geçmek lazım sanırım,1
1591,kendisi bunu açıklamıştı Turkcell teknoloji zirvesinde bizde terlikle bile işe gelirler demişti önemli olan mutluluğu,1
1592,iş dönüşü nimbuzz la bağlan hayata,1
1593,koskoca Tekirdağ Turkcell şubesi bulamadım vay be,0
1594,kesinlikle Superonline tartismasizzzzzzzzzz,1
1595,mesaj alamıyor yaklasik haftadır mesajciklarimi geremiyorsam senden vazgececegim anlamına gelebilir Turkcell kerem seyissin sen böyle,0
1596,eksik bilgi sonrası mağduriyetiniz özür dileriz yok azından bundan sonra işlemlerin Extra taife dışı,0
1597,bağlanamıyorum mü temsilcisine şikayet Edi'ce ulan sizi btk yeter ulan sömürdüğünüz sefer aradım seferinde,0
1598,git babanı kandır,0
1599,ben eski seviyorum ulaşmak önce kurumsal aşmak gerekiyor negEmos,0
1600,hayat paylaşınca güzelmiş hah kusura bakmasın Turkcell ben seni kimseyle paylaşamam,1
1601,bu sorun var mesaj atamıyoruz reis,0
1602,hayatpaylasincaguzel calismiyor Turkcell duy beni,0
1603,sırf uygulama mesajlarınız yüzünden bık tüm dedirttiniz bravo,0
1604,Bosna kadar kişi calisiyor orda sen hitap ediliyor Turkcell gibi bir kuruma yakismiyor,0
1605,değil Turkcell in son reklam kadar gerek ustu lan Copy'unun hatundaki telefon falan,0
1606,coca yola ın son reklamı güzel Turkcell den iyi duygu sömürüsü yapmışlar,0
1607,Superonline mağduru yoktur emin ol durduk yerde milyar kitlediler bana Superonline çok yalancı kandiriyo posEmos negEmos,0
1608,iyi olmuş yalaka acun kıl oluyordum batsın sürünsün Turkcell fatura olarak ödediğimiz paraları cebe indiriyormuş şerefsiz,0
1609,bostancı gösteri merkezi doğru yoldayız konserimiz tüm Sarko'lar Turkcell global bilgi için sevgiler negEmos,1
1610,günlükleri yol bilmem kaç sen mektubu okurken ben çoktan seni terk edip buralardan gitmiş Olucak,0
1611,saatte telefon faturası gönderilir be Turkcell ben şimdi huzurla uyuyacağım,0
1612,önemli değil cem demişler hayat paylaşınca güzel yazımında kendi çapında bir karakteristiği yok değil teşekkürler posEmos posEmos posEmos,1
1613,kelimeyle Turkcell beni uzdu,0
1614,beni hale getiren Turkcell utansın zorla İnternet paketi kitledi posEmos,0
1615,iyisi varsınız olmasanız mesaj geleceği yok telefon özelliğini unutacak nerdeyse kadar yalnızım posEmos,1
1616,City'deki Turkcell tam bir dolandırıcı Phone kontratlı fiyat sordum ten başlıyor dediler yalan yanlış bilgi veriyorlar,0
1617,Turkcell yağlı kurşunlara gelesin emiiiiii,0
1618,senden nefret ediyorum Turkcell kar mutsuz ettin beni bunca yıllık beraberliğimiz bunu haketmiyordu negEmos,0
1619,çeken ınn elde ne çekiyor açık havadanı kullanıcaz Turkcell bunu düşünemedin yaaa,0
1620,masteri hizmetlerine baglanirken kere Turkcell beni sesimden Taner dedirttiler kafayı yemin bunlar demedi demeyin,0
1621,arada Turkcell camlayan adliyesinde Full çekiyor ben başka reklam bilmem,1
1622,Turkcell kalpkalp şirinlikleri sana yapıyor posEmos posEmos posEmos posEmos,1
1623,kurumsalsaniz almak kadar zor seferinde Sadri'mizi zorlamasanız negEmos,0
1624,Turkcell müzik muhabbetini sevdim posEmos,1
1625,yapacak birşey varsa bulursan senin durumundakileri düşünürsün değil mi olsa hayat paylaşınca güzel posEmos,1
1626,saat benim amsım bıttıı alacağın olsun Turkcell,0
1627,bir hafta içerisinde kurulum yapacaktiniz araya bayram tatili girdi zamandan zamana arayan gelen var,0
1628,seni ben İstanbul un bütün semtlerinde Ege çekmeyi başarasın mi sevdim ey,0
1629,özümle dk snye konuştuk Turkcell bize dua ediyordur şimdi posEmos,0
1630,olma tl ye sms paketimi olur Allah belini versin Turkcell,0
1631,Superonline warken ttnet laf dusmez bence şiddetle tavsiye ederim,1
1632,sorun Cell posEmos,0
1633,oha ara tl olmuş valla para çekiyor Turkcell,0
1634,korkunç bir ülkede yasıyoruz herkes kazak atarak bireyler kazanma pesinde Superonline bunların basindaymis,0
1635,basit bir maile bile dönüş yaparak sorularıma cevap veren Superonline müşteri hizmetlerini kutluyorum supersinsuperonline,1
1636,ozmnn Turkcell çok eslilikten yana,0
1637,lan Turkcell basımı argıttın gece gece Allah belanı versin senin,0
1638,Turkcell kafayı yemin gün sonra bitecek olan paketim için şimdiden mesaj atıyorsun kardeşim,0
1639,yeni film vizyona girerken gnctrkcll şifresi arayan milyon kişi var Ahat'a,1
1640,sağolsun Turkcell İnternet yerlerde sürünüyor bende yarımyamalak bu sevinç yaşıyorum posEmos,0
1641,önerisi faturalı hatta geçtim tarifem dk tl olduğu dışında birşey söylenmedi aralık sinde tl ilk faturam,0
1642,mesajsa Turkcell bir arayansa annemdir yalnızım negEmos,0
1643,saygideger Cell data ses Hatti'mdi kapamis hayrolsun,0
1644,Turkcell benden habersiz sms paketimi yeniliyor gıcık oluyorum belli değil,0
1645,cep telefonu melodısı Turkcell şarkısı olan adam Mehmet emin Karamehmet'in oğlu herhalde,0
1646,bir Phone bağlanmaz Turkcell sorun bende değil der teknik servise gitti geldi nda hala görmez tel amacı değil,0
1647,çıkmadan solayım dun sms yaptıktan sonra baktiim Kiir'i bedava dk kazanımsım parti heryone sms Turkcell sms yapmam bekliyomus,1
1648,bence direk al ayni gün aciliyor we Turkcell çok dha awantajli,1
1649,Superonline fiber İnternet tavsiye ederim hızı gayet iyi ilk başlarda sorun yaşadım şuan memnunum,1
1650,kontörlü hatlardan vergi kesilmeye başlaması yeni adetiniz olmalı,0
1651,Turkcell arıyorum beni Yanis bilgilendirdiniz şikayet etmek istiyorum diyorum masteri temsilcisi maalesef diyor yok böyle birey,0
1652,kubatın sesiyle katkıda bulunduğu igrenc Turkcell reklam kadrilsin,0
1653,inovasyonda büyük ödül Turkcell in,1
1654,şerefsiz Turkcell öl geber tamam mi,0
1655,kimse takmıyor beni Yaaa'da Turkcell bana mesaj saat posEmos,1
1656,Turkcell elinden gelse hattı çıkartıp tekrar taksak para alacak posEmos,0
1657,zaman sana bir soru yıl Turkcell kullanıp bu gazla Avea geçtim şimdi yine Turkcell geçmeyi düşünüyorum sence,1
1658,iade demelerinizi Perşembe günleri yapıyorsunuz tamam deyin Kayin'ci Perşembe oldu kayıt tutun lütfen Superonline,0
1659,git allasan yillarimi Turkcell verdim biraz spayı sopa bile vermediler,0
1660,öyle Avea igrenc bu kere arkadaslarim Turkcell sms fon var parası önemli değil Turkcell iyi posEmos,1
1661,hayat yeni yıl mutluluğunu paylaşınca güzellll posEmos,1
1662,lanet olsun Turkcell faturam kontrol etmek fon istemiyorum biraz artık pesimi,0
1663,cim ok seviyorsun beni lakin ben istemiyorum msjlarin yetmezmiş gün boyu aramak nedir almayan özge acmiyor,0
1664,Turkcell sun ekspres arasındaki anlaşmaya bu göz at hemen fiyatlar yari yarıya posEmos,1
1665,kesnlikleee Turkcell kapattı hemen posEmos,0
1666,hattınız Turkcell yalnız değilsiniz demektir yoksa hergün düzenli olarak mesaj gönderir,0
1667,böyle yapıyorsun,0
1668,lazım acun milyon verecek faturada bize döşüyor Turkcell posEmos posEmos,0
1669,hala pahalısınız,0
1670,ibne Turkcell sesli mesaj var sms geliyor sesli mesaj dinlemek için kurum veriyorsun sesli mesaj Turkcell den kimi sikiyorsunuz,0
1671,yozum uretemedınızmı Turkcell haftadır cevap bekliyorum,0
1672,seni seviyorum Turkcell ben tl derdine düşmüşken dakikam oldu iyisi varsın,1
1673,hayat paylaşınca güzel,1
1674,paylaşmak güzel onunla paylasiyrz bizimle cihazlar Paypass'a sloganın hakkini verse Turkcell posEmos,0
1675,bugün Turkcell mesaj atmadı kesin başkası var,0
1676,ekim gucu Turkcell Victoria meleği Vodafone hadise kapsama alan Victoria cm hadise cm,1
1677,gördüğü hızlı Turkcel müşteri temsilcisisin asıl ben teşekkür ederim posEmos,1
1678,nihayet eve fiber İnternet geldi Superonline Karamehmet in yıllar önce döşediği fiber ağı engellemeler yüzünden anca devreye sokabildi,1
1679,bence hayat paylaşınca güzel lalalalalaalaaaa,1
1680,dan mit aldık video bile izleyemiyorum müşteri hizmetlerinde berbat nerden ttnet bıraktım ttnet mit gt Superonline,0
1681,Murph cay reklamından sonra psikolog desteği almaya karar verdim önce Turkcell sonra bakalım neler cikicak,0
1682,sana yazan Turkcell gönderin sonra faturanızda gurursunuz kadar Sanel'i olduğunuzu ben çok sansliymisim coooookk,0
1683,aynen benim abim Bingöl'de yapmıştı askerliğini dağın tepesi orada bile çekiyormuş Vodafone trcell çekmiyormuş posEmos,0
1684,kalp kalbe karşı şimdi Superonline aradım hizmet fiyat iyi oradaymış,1
1685,askınım ay acıcam bu Turkcell geciyim,1
1686,taşı rahatla hadi bakalım,1
1687,medyada yer alan olumsuz haberler klasörünün Turkcell genel müdürü Süreyya Ciliv gösterilmediğini düşünüyorum ciddi ciddi,0
1688,paylaşmak güzeldir diyor Turkcell lütfen benimle telefon faturam payla bu aylık lutfennn lutfennnn,0
1689,Turkcell iyice uçtu ama yok yükle al yükle al hesaplamalarıma göre bin tl yüklesem şirketi üstüme yapacaklar,0
1690,lan Turkcell bak yeni cihaz veriyormuş sonunda,1
1691,hayat paylaşınca güzel,1
1692,normalde küçük harflerle sms atan Turkcell in fatura tutarı yada son ödeme tarihi bilgisi attığı smslerin büyük harfle olması,0
1693,Turkcell hizmetlerini arıyorum mesaj bırakıyorum nedense bir türlü geri dönmüyorlar Turkcell duyurulur posEmos,0
1694,Phone gb beyaz aldım Turkcell den hayırlı olsun bana posEmos,1
1695,insanlar Turkcell bayisindeki konfor bulunur yazısı kadar gereksiz,0
1696,dakikalar teşekkürler arada gün içinde sms atmayı unutma kendimi yalnız hissediyorum,1
1697,benim gsm alakasızlığım olacak Turkcell ms yollamış gündür tl yüklemiyormuşum şikayetçi elimde olsa çöpe atıcım telefonda posEmos,0
1698,emniyet mudurlugu Turkcell besiktas belediyesi mesaj konusunda yaridir,0
1699,itirafetmekgerekirse arkadaşımın Reaper'inden sevgilisinin adını Turkcell olarak değiştirdim sevgilisi zaman mesaj atsa okumadan siliyor negEmos,0
1700,valla hacı Superonline var kafam rahat kusura bakma öyle yani,1
1701,Phone kanyon Turkcell var ilgilenenlere duyurulur çok kalabalık tükenmeden alin derim,1
1702,onunla kavga ederse onun bu ms beklrsn anda tl bir ms gelir heyecanla bu Bkar'sın mscı atan Turkcell işte an yıkldğn an dır,0
1703,gördüğüm adi şerefsiz kurumsunuz,0
1704,Ohal'a bedava dk kazandım la canim Turkcell ani not etsin bir bunu ayak kafayla demem onumuzdaki cumartesi dk olacak negEmos,1
1705,bir bir bir,0
1706,ime kavuştum sonunda eski meslektasim Sümeyye Öztürk sayesinde harika bir Turkcell calisani posEmos,1
1707,gercektenbiktim Avea Turkcell Vodafone reklamların dan tiskindimm hava,0
1708,lan Türkel saçma salak genç kafası at kafası kampanya reklamlarının mesajlarını atmayı kes,0
1709,keşke olsaydım önemli bir işim vardı Turkcell borcum başıma iş açtı onunla uğraştım icra icra,0
1710,sonunda artık burda Turkcell Hatim calisiyooorrrr posEmos,0
1711,bu Turkcell mesaj atıyor bu Turkcell bu Turkcell negEmos,0
1712,hayat paylaşınca güzel lalalalalalalalalal posEmos,1
1713,oh be çok mutluyum Dakka'm sms verdi Turkcell posEmos posEmos,1
1714,kampanya sms yerinden başka iletişim kuramayan Turkcell ödül almış herkes birbirini ağırlamış hayat faydasızca güzel,0
1715,muzır paket yapmaz kıyıp tl ni alıp bırsey yapmayan Turkcell eski sevgılınızle kankıymıs kızlar hanı sevmek ısterseniiz,0
1716,reklam filmlerindeki dış ses in son yıllarda rte tonlamasında konuştuğunu Kasımpaşa'yı statla fark eden bir ben değilim,0
1717,umarım rakamın sonunda tl ibaresi yoktur Turkcell deyince aklıma sadece fatura geliyor posEmos posEmos,0
1718,Urgun'um aslında Nursel duy beni Turkcell bizi ayirmasin artık beril sende ak su telefonu soru cozucektin bana,0
1719,ey Turkcell cepten İnternet istiyoruz kısa zamanda çözünüz,0
1720,hayat paylaşınca güzel lalalalalaalaaalaaaaa,1
1721,mb limitsiz İnternet bağlantısına kota koyan zihniyeti kınıyorum Superonline,0
1722,senedir kullandığım faturalı hattımı eksik belge yüzünden yılbaşı öncesi aramalara kapatan ey vefasız Turkcell,0
1723,Superonline Turkcell an İnternet hızımı saygıyla anıyorum mit gerçekte mit ban,1
1724,kişisel bloglardan Turkcell blog ödülleri nde halk oylaması sonucu finale kalan ilk blog mont,1
1725,İnternet paketim var Turkcell hala konfor ali benden,0
1726,bir adam vardı canı sıkılıyordu bir film izledi can sıkıntısı gitti eski bir Turkcell reklamı hey gidi günler posEmos,1
1727,cep telefonuma gelen mesajlardaki kıran kırana kapışma emniyet garanti bankası Turkcell Beşiktaş bld arasında devam ediyor,0
1728,benim Turkcell bugün fena dağıttı deneme Tweet'edir,0
1729,ailem Turkcell benim başka hatta gelmem olmaz posEmos,1
1730,sarı aletimi is yerinde unuttum Avea min sms bitti yedek hat Turkcell attirdigim tl gelmedi ortada kalakaldım,0
1731,dur bu mesaj atalımda sevgilisinden geldi Sensin Turkcell,0
1732,bakirkoyde Superonline vardi mi basvurmadik hadi bakalım ben kattim sağol sen yine Open'i,0
1733,bunun kufurler Turkcell of,0
1734,kahve dünyası yaptığınız kampanya süper bitmesinin seviyorum seni Turkcell posEmos posEmos negEmos,1
1735,turkcellesavasimvar size savaş almış hala reklam yapıyorsunuz,0
1736,he valla geçtim lan Turkcell iyi Avea apaçi isi artık,1
