,Tweetler,Duygu
1154,kubat mı Turkcell reklamı kadar nefret ediyorum çıktığı gb kapatıyorum son Ciliv sen böle hatalar yapmazdın,0
1155,öğlen attığım mesajlar şimdi iletiliyor oha Turkcell,0
1156,Turkcell Avea dan farklı,0
1157,Öztürk tiplemesi bile Turkcell sevmemek bir sebep,0
1158,huzur bereket sükunet,1
1159,hayata bağlan turkcelleeeee,1
1160,hayat cebinizdekileri bizle paylaşınca güzel selofanlara bile uyum York all nite da pay th Bill hava to pay ait it sad negEmos,0
1161,Twitter ın Güzin ablası oldunuz ben Turkcell den şikayetçiyim aydır sorunumuzu gidermediler dikkat gideremediler değil,0
1162,Turkcell le taglansak hayata herşey kolay olur posEmos,1
1163,hayat okuduğunu paylastikca güzel sloganıyla vapurlarda gazete dagitan Turkcell Hayy yaşşaa len Turkcell demek geldi içimden my,1
1164,sen olmadan sarılamam zaten Birtane'm eksik kalır yok olurum hayat seninle paylaşınca güzel,1
1165,ananda al git Turkcell yoksa çok kardeş gelecek sana coooookk,0
1166,in yaptigi seyahat kampanyası yerinde aralık ayında uyguladiklari sistem çok Yanis,0
1167,hayat paylaşınca güzel posEmos,1
1168,şeker şen ceza olgun Şimşek Binnur kaya sana söylüyorum firmanın reklamına çıkmayın yaşasın,1
1169,paket aşım ücreti tarifene tüküreyim Turkcell,0
1170,turkcellfestival harika yorumlarından dolay model teşekkürler tabii Turkcell posEmos,1
1171,hayallerimin ilk sırasında aylardır söyleyip durduğum numaramı Turkcell taşımak var hayal olarak kalmasın nioğğlur,1
1172,Superonline posEmos,1
1173,Turkcell liraya veriyor boş verin Area'yı Turkcell'de alın posEmos,1
1174,beni unutmayan tek adam Turkcell,1
1175,iso inovasyon büyük ödülü nü Turkcell teknoloji araştırma geliştirme iso inovasyon jüri özel ödülü nü Royal halı kazandı,1
1176,hayat paylaşınca güzel Turkcell posEmos,1
1177,Turkcell kadar şerefsiz bu operatör bilmiyorum,0
1178,bu Turkcel bu dijiturkten cektigim kadaaar,0
1179,sayın Süreyya Ciliv klasör yok sizi olumsuz haberler konteynırına götürelim isterseniz posEmos,0
1180,değil Turkcell reklamlarında milleti kandiriyor Cloud sadece Phone te varis gostermisler,0
1181,bende Turkcell kullanmıyorum posEmos,0
1182,Turkcell cekmiyo papa,0
1183,İnternet hızım değil su hızı arttırın yoksa Superonline alacam,1
1184,orospu cocuyu Turkcell Online işlem yapıca şifremi göndermiyor,0
1185,kötüsü sms olmadığı zaman telefonum defalarca öter olduğu zaman sadece Turkcell kontürlerimi yemek kampanyalar sunar,0
1186,bukutudanevar yayında inanılmaz vizilti var teknik masa lütfen çözün,0
1187,Turkcell harbi pil,0
1188,konuyla ilgili gösterme bir destekle kursiyerleri Turkcell abonesi yaptıktan hemen sonra desteğinizi çekmeniz size yakışmadı,0
1189,kusurlu hizmet veriyorsun Turkcell ben seni kadar severken yapma bana bunun,0
1190,sevgili paylasinca güzel demek Turkcell,0
1191,Turkcell reklamına bayiliyorum mekaniğini anlayamadan hahhaha ozturkselli olmak istiyorum posEmos,1
1192,mb sık İnternet kullanımına tl fiyat geçiren Turkcell itiraz edince geriye dönük tarifelendirme yapıp ücreti liraya düşürdü,0
1193,Ohal Turkcell Vodafone i̇phone fiyatlarını uçurmuş,0
1194,evet ben vodofon vın kullandım İnternet uygun hat olarak Turkcell iyisi bence,1
1195,yılından zamana kadar kullandığım Turkcell hattımı Turkcell'in tutumdan dolayı protesto olsun kapattım yüküm hafifledi,0
1196,manga konseri harikaydı acun ılıcalı manga Turkcell teşekkür ediyorum,1
1197,biliyomusunuzzzz Turkcell oluyorummmm bilmezsiniz tabi yeni karar verdimmmm,1
1198,Turkcell bağlan hayata diyorum posEmos,1
1199,kaç sonbahar kaç kez dedim hayaaaatt Vodafone Freezone kullanmıyorum hoşuma gidiyorum ben genç Turkcell Türkel li̇ni̇n gücü,1
1200,bide çeker Dino'ya çekmiyor vın almstm çekmedi geride almadılar zorla iade etti,0
1201,ye kadar sms hakkinizi kullanabilirsin diyen sevgili Turkcell Allah rai olsun sen olmasan napardim demek istedim,1
1202,rahat bırakırsa uyuyacak,0
1203,haketmediğim halde beni mağdur eden Turkcell protesto ediyorum param ödenmiş güncelleştirmem yapılmış ve tel kapanmış posEmos,0
1204,kendimi kadar yalnız hissetmemiştim reyhan Turkcell mesaj attı saat içinde,0
1205,hay baslicam senin sagladgn ye dere ekim gucune dee,0
1206,millik tecrübeme dayanarak söyleyebilirim yerde çeker büyük yalan Turkcell Bakırköy çekmiyor güneşli hiç çekmiyor,0
1207,bende kazıkçı Turkcell liyim,0
1208,Turkcell'de başka mesaj atanım yok diyenler olma susun Turkcell gene düşünceli Avea nerdeyse atmıyor yalnızlıktan ölücem,1
1209,hayat paylasinca güzel posEmos,1
1210,lanet olsun metroda çekmeyen Turkcell zaman posEmos,0
1211,sanırım Turkcell benden hoşlanıyor sıradışı mesajlar kampanyalar hediye dakikalar fırsatlarrr bu güzellik yapma derdinde posEmos,1
1212,azından müşteri hizmetleri ses kayıtlarımı vermezseniz bile çevirip çevirip dinlemenizi tavsiye ederim posEmos,0
1213,Turkcell den aradılar iş görüşmesi yarın cazgırdılar geldiyse aklımda yoktu güzel olur gelebilirim posEmos,1
1214,gerizekalı Turkcell cekmıo babaannemde posEmos,0
1215,sabah vapurda Turkcell hayat paylaşınca güzel diyerek gazete dağtyor cumhuriyet hariç bence güzel değil,0
1216,olum bak Türkel sana pis gıcığım ikidir ters gidiyorsun bana artık Vodafone geçme zamanıdır,0
1217,hayat paylaşınca güzel,1
1218,mesajlarımın iletilmeyişine iyice sinir olmaya başladım batarsın inşallah Turkcell,0
1219,bir Turkcell gsm şehrinde neler oluyor eğitimindeyim baya olaylar oluyor durumlar fena posEmos,0
1220,marka keşke puan orada olsam Türkiye Gercek'len değerli oluşumlardan benim için konferans değerlisi tabii Turkcell posEmos negEmos,1
1221,ama Turkcell sesi sms yapmadii hala arayamam mal,0
1222,Turkcell iyice mala bağladı kampanya msjları yetmiyormuş bu sesli olarak araya kampanya dinletiler bana sapık mıdır nedeler,0
1223,Turkcell panolarından fotoğraf Almus sevindim,1
1224,aile operatorumuz Turkcell posEmos,1
1225,sen yine Turkcell mi döndün sanki,1
1226,yilinin iyi reklam yapan gsm operatoru kullanıyorum,0
1227,özturkcell seninle ölmeye geldik özturkceeeeeellllll hasan doğan spor kompleksi posEmos,1
1228,Turkcell cekmiyormu,0
1229,öyle huzurluyum Turkcell bile ariza cikarmadi derece posEmos,1
1230,yasattigimiz süper masteri deneyimi için onurlu gururluyuz Turkcell Superonline,1
1231,şerefsiz onursuz tamamen kapitalist hileci bir firma sizi ödemeli arıyorlar ilave çalıyorlar Kars,0
1232,zaten iletişim kalitesi kötü ben memnun kalmadım Avea dan Turkcell pahalı hizmet iyi,1
1233,in Phone sloganı çok amotrce olmuş bugüne kadar yapılmış iyi Phone posEmos,0
1234,hayat kesinlikle paylaşınca güzel posEmos,1
1235,Ohal ama tl fatura geldi bana ananın amı Turkcell,0
1236,abi zannetmiyorum malum Turkcell burundan kıl aldırmaz platform farklı müşteri kapmak kampanya yapılabilir negEmos,0
1237,neye uyuz olduysam reklamlarına hayran oldum cocacola zaman Turkcell reklamcılık harikaları posEmos,1
1238,bu sesli mesajım var sevinirken Turkcell çıktı giyim sana Turkcell defol git Turkcell,0
1239,elektrik gitti Allah tan var Hanks Turkcell posEmos,1
1240,senden şimdi formspring den soru yardım isteyecektim canını telefon hala kıpırdamıyor Turkcell dürtebilir misin aşk,0
1241,sabah afyonum patlamadan tl çalıp actiginda Turkcell in bana kaydı olduğunu anladığım an içimden söylediklerim,0
1242,Turkcell artık yapacağını şaşırdı abi kontör yüklediğin an paket olmadığı halde yenilediği şeyler var,0
1243,bunların böle Digiturk Turkcell telekom soyguncu,0
1244,zaman senin Kars'ın çıkan denyoların Turkcell in yöne ms kampanyasından haberleri yoktu posEmos posEmos posEmos,1
1245,Türkel bugün bildiğin taciz etti beni dk rahat vermedi,0
1246,evlere kadar ulaştırmak çabalıyoruz hizmeti kimse veremedi veriyoruz herkese fiber posEmos,1
1247,divandan doğum bunu pastası göndermek valla Yasir'dim tesekkurler Turkcell posEmos posEmos,1
1248,kısa süre içinde Superonline olan ilişkimi bitiriyorum ilanen duyurulur,0
1249,attığın Turkcell numarasını kullanıyorsun güzellik hemen ısı ısı ederiz posEmos,1
1250,divane asit blog Turkcell blog odullerinde son kalemis destek veren herkese tesekkurler,1
1251,Turkcell Superonline,1
1252,Turkcell kullanmayı bırakan kişi şikeciler posEmos,0
1253,arkadaşımın telefonunda sevgilisinin adını Turkcell değiştirdim gelen msjları okumadan siliyor ayrıldı,0
1254,olursa olsun Turkcell candır posEmos,1
1255,bloguma İstanbul dan yorum bırakan Superonline müşterisi git kendinle kafa bul tabi bulman kafa lazım neyse,0
1256,Turkcell çok gıcık oldum sana,0
1257,oda arkadaşım bana mesaj attı geldi gayet onun operatör ben hala yollayamıyorum amaca,0
1258,lütfen gece den sonra bana mesaj atmaktan vazgeç,0
1259,lizliyim harirsiz degilimm bejcede Gori'selim Turkcell boy posEmos posEmos posEmos,1
1260,ölmeden önce söylenen son sözler calisilan şirket Turkcell sayın patron arkadaşlarla birlikte topluca Vodafone geçiyoruz toplu katliam,0
1261,Turkcell chp Amis Anka sitemizden bakabilirsiniz hala kitaptayım posEmos,1
1262,kesinlikle Superonline hatta Tivibu'lu öneririm gayet güzel imkanları var posEmos,1
1263,kötü espri yapanları seçiyorlar ya noktada hafta boyunca çektiğimi gördün sn Turkcell dakikada hediye etti posEmos,1
1264,başlayan oturumu kapatıp ilgili kotayı ocak ye ekleyen Superonline buradan alkışlarla kınıyorum,0
1265,bugün bana yaptığın haksızlığı sana unutturmayacağım hani yöne kampanyası artık yaşasın Turkcell seni terkediyor Avea negEmos,1
1266,bir fırça attım akşam akşam rahatladım posEmos,0
1267,bu merhamet et günde ms kime yeter adı bızı düşünmüosan alttan gelen neslimizi ergenlerımızı dursun ergenler msjsz kalmasın posEmos,0
1268,Phone konusunda babamın kanına girdim bugün Turkcell den aldığım katalog yanına gidip istiyorum bunu dedim posEmos posEmos,1
1269,İstanbul birazda İzmir'de bir şeyler yapsanız,0
1270,ben zaten Turkcell baktım Turkcell den vazgeçmem türlü kaliteli bir ara Vodafone kullandım ikinci hat yok asla,1
1271,Migros ta telefonunu Turkcell taşıyana tl ilk alışveriş hakkı veriliyormuş yakında numarasını taşıyana maaş bağlayacaklar herhalde,1
1272,günlükleri yol bilmem kaç Rumeli caddesindeki abone merkezinde nakit parayla fatura ödeyemiyorum,0
1273,gerizekalı Cell gece bedava vereceğine gündüz verseydi olurdu,0
1274,oha saçmalığa bak Turkcell İnternet paketi için iki kere ücret aldı sadece yüklenmiş,0
1275,paragöz Turkcell nasip kadirdi First'i hayyyyret posEmos,0
1276,tl mi tl yapma Turkcell sus bu mınakodum sus saat başı mesaj atılır,0
1277,bir haftadır gezdiğim Turkcell timdeyim kimse modem teslimi almaya yanasmiyor beceremiyor istemiyorlar adam cildirttilar,0
1278,Turkcell yaptığı belli olmaz,0
1279,Turkcell sen personeli̇ni̇n,0
1280,ufunette bastı yine keşke Turkcell olsan tarifeni değiştirsene sen yaa posEmos,1
1281,Hepsiburada kvk Turkcell Vodafone ye sövesim geldi sövmedim Blackberry sövesim geliyor sövmicem ben Nobel inde,0
1282,pahalı olunca kaliteli oluyormuş diyor uyduruk bir operatör ben parası neyse veririm yerde şeker konuşurum diyorum,1
1283,Turkcell tv projem ilgilenmedi masteri memnuniyeti girişimcilere destek,0
1284,Superonline varsa iyi,1
1285,saatte gelen mesaj elbet Turkcell den gelir senden gelecek değil,0
1286,dundur tv yayını var İnternet Turkcell mobil İnternet olmasa yapardım negEmos,1
1287,sağolsun bir Turkcell beni yalnız birikmiyor,1
1288,gün önce kontör yükledim Turkcell günden beri tane mesaj attı,0
1289,Turkcell hayatı paylaşmaktan yorgun düşmüştür başınızın çaresine bakın posEmos,0
1290,kıble kadar konuşuyorsam ay Turkcell kıtlıyoooooor,0
1291,Turkcell iyi lan durduk yere mesaj atıyor kampanyalarıyla mutlu ediyor falan sevgilim görüp kıskanır umarım posEmos negEmos,1
1292,Turkcell den yeni bir hizmet unutkanlık numaranızı verin yine soralım hayat salladıkça güzel,0
1293,artık var Turkcell'in sitesine bakınız,1
1294,walla durma bence Turkcell posEmos,0
1295,dun Vodafone Cabir cubur cekiyoodu Turkcell trt cekiyo cekmiyo reklamlarinin sonucu Turkcell,0
1296,böyle giderse ben Avea akar hacı kaydin beni Turkcell,0
1297,çok ayıp Fenercell'i dururken Turkcell neyin nesi posEmos,0
1298,Turkcell ailesine Turkcell müşteri temsilcilerine mutlu sağlıklı yıllar diliyorum sevgilerimle,1
1299,direk Turkcell ınn al kurtul iyisi şuanda ttnet iyi sayılır,1
1300,osesturkiye Nurullah insana huzur veriyor sesin,1
1301,Turkcell judo indirimin güzel olmuş valla,1
1302,küstüm Turkcell,0
1303,bu coca yola bu Turkcell zaten reklam işini bilen,1
1304,kontör yükleyince yalakalık yapan Turkcell insanlar var,0
1305,in şirketimize atadığı müşteri temsilcisi yüzünden ofise davet ettik görüşüp komple geçmeyi düşünüyoruz,0
1306,bazen kadar uyuzsunuz başka operatörün kapısından dönüyorum harbi kaldı İnternet paketi ilimi kuruttunuz,0
1307,afedersin Turkcell çok kazak posEmos,0
1308,telefonumun bozulması sonrasında Turkcell den gelen yedek telefonda bozuk çıktı an,0
1309,İnternet kadar yavaş Premium account dan Download yaptığım halde fren eser dan bu farkım yok resmen Superonline,0
1310,su an iniyor saat verdi mtv ye derhal gizli insin Superonline fiber güzeldi ama cihangir posEmos,1
1311,can sıkıntısından ölmek üzereyim Turkcell im mi varsa onun celsede kurtulsam,1
1312,cem ben Superonline kullanıyorum kesinlikle çok gizli acayip memnunum tavsiye ediyorummm,1
1313,ses Turkcell geri salim basladi elemelerde son lira geliyor posEmos posEmos,1
1314,nedir senin derdin Turkcell aramada krşkontor yemek zorundamısınn posEmos,0
1315,ohhh ayki tel fatura paramı tamirci senden önce kaptı Turkcell,0
1316,arada telefonumu açtım Turkcell art arda mesaj attı korkmaya başladım ben Turkcell arkadaş olarak sevmiştim negEmos,0
1317,müzik ihtiyaçlarınızın dinleme indirme keşfetme vb Turkcell kalitesiyle tek bir uygulamada toplanmış olması fena posEmos posEmos,1
1318,hayatpaylasincaguzel paylaşamıyoruz Cell odamdan çekmiyor bir alo demek dk harcayınca paylaşmış olmuyoruz,0
1319,Huawei Turkcell bütçe gelişmiş kullanışlı telefon posEmos,1
1320,ne ben açtım Turkcell beni kazıkladı hala şifre yok posEmos negEmos,0
1321,teşekkür ederim Selcan posEmos,1
1322,Turkcell wc deki çekim gücünle beni ergene bağlatacaksın bunu diyorum benden kork,0
1323,burdan gsm operatörlerine sesleniyorum sen Turkcell sen Vodafone sende Avea vapurda artık telefonlar çeksin you can easily realite,0
1324,iyisi ben yarın Turkcell gidiyim posEmos,1
1325,derlerse desinler Turkcell hala yoğun gsm operatoru zaman gelsem dolu,0
1326,Turkcell Avea varsa alabilirim,1
1327,Vodafone cennet and Turkcell ınn kamu negEmos,0
1328,selam yeniden haxball canını yiyeyim Turkcell Superonline,1
1329,elimi hünkarca ısıran kediye İnternet'imi kktcnin hızlı İnternet olacağı vaadiyle bizi kandıran Superonline büyük küfürler hazırlım,0
1330,sefil Turkcell birgün herkes yaptıklarının hesabını verecek mezara fatura gönderen Cell,0
1331,bide heryerde çeker diyorlar,0
1332,hele mesele evet ttnet kapattırdık yerine Superonline bağlattırdık hamdolsun ayrılık bu hafta sürdü geri döndüm gene posEmos posEmos,1
1333,rüyamda Turkcell den telefon edeceğinde önce telefondan çıkan reklamı dinlemek zorundaydın işim acildi ruya dediğim kabustu,0
1334,telefon aldım Turkcell den Vodafone çevirmek bu şifre vermeleri lazımmış kaç saattir yok sinir oldum kuzu,0
1335,beş gündür Turkcell den mesaj gelmiyordu bugün seni özledim Turkcell yazıp gönderdim kontör,0
1336,olmasa telefonum mesaj özelliğini unutacak artık posEmos,0
1337,yazık bence Turkcell mobil ödemeyle yemek sipariş et posEmos posEmos,1
1338,orospusun Turkcell biliyorsun paketimin bittiğini inadına mesaj atıyorsun posEmos posEmos,0
1339,evet katılıyorum Mehmet'sim Turkcell in kekeme gücü mükemmelle hiç bu yerde cekmio negEmos,0
1340,Superonline yine birincil dns sunucusu hatası verdi baglanamiyorum,0
1341,madem bitti yenilemesi gerekir Turkcell ilginç mağdursun posEmos,0
1342,hayat paylaşınca güzel boşuna dememişler posEmos,1
1343,bugün mesaj atmadın hayırdır küs müyüz yoka rahatsız mısın,0
1344,turkcellmuzik yaşasın manga yaşasın Turkcell posEmos,1
1345,alara şimdi derin nefes al beynine oksijen gitsin ayrıca Turkcell bana bokluk yaptı,0
1346,zaman Turkcell le bağlan hayata posEmos,1
1347,aralar sadece beni düşünen tek Turkcell var,1
1348,Turkcell saygı çerçevesinde düzeyli bir dostluğumuz var bana yapamazlar öyle birşey posEmos posEmos,1
1349,çekemeyen anten taksın sticker dağıtmış ben yaptırsam özel olarak posEmos,1
1350,teşekkür ederim Turkcell üzerinden İnternet bağlanırken sorun yaşam anlam veremedim geçti teşekkürler,1
1351,gecenin ünde hat kesilir mi beyefendiler arama merkezini arayamıyorum net şifremi hatrlamyorum iletişim algınız farklı,0
1352,İnternet paketim bitmedi bitmesi gerekiyordu buyursun Turkcell posEmos,1
1353,zaman evet bağlantı dns bir alakası olabilir Superonline arada gidip geliyor,0
1354,İnternet'ime yaklaşık haftadır dümdüz sövüyorum yemde öyle böyle değil sanırım artık Superonline zamanı geldi üzgünüm Uydunet'e,1
1355,sen çektin dan hala bir tepki yok iyi liyim geçmiş olsun Denis'tir artık hakettiler negEmos,1
1356,capstone boşverip Superonline başladım şuan ah ah,1
1357,Turkcell umarım bundan sonra kafasına sarı anten geçiren mı mı konuşan ayağına inşaat çizmesi giyen çocukları kullanmazsın reklamlarında,0
1358,serdar Erener ülkenin eniyi reklamcılarından biriymiş bunu in üzerinde müşterisi kaçana sormak lazım hata Turkcell in kalitesinde mi,0
1359,hüzün umut belirsizlik,0
1360,saat süper normalde Atatürk'ten gidiyorum Turkcell Sunexpress kampanyasından yararlandım ucuza geldi baya posEmos posEmos,1
1361,hayat paylaşınca güzel posEmos,1
1362,mahalleden Superonline geçse iyiymiş,1
1363,Turkcell iyice aştı kendini dakikada mesaj gönderilir mi insan içlerinden başkasındandır umutlanıyor insafsızlaaaaar,0
1364,meğerse hesabını çalanlar beni kazıklamışlar tl kazık girmiş oldu faturama Turkcell konuyla ilgili,0
1365,inanır mısınız anda İnternet paketim yok hatta tl mden gitmiyor Turkcell bizi kazıklayacak canım posEmos,0
1366,evrakım ödemem tamam tel kapalı ağır hastam var lanet olsun sana Turkcell ölmek istiyorummmm,0
1367,pahalı dedim dışarıdan almak lazım dedim olmadı kayıtla uğraşacağıma Turkcell den istedim keşke aylık seçenek sunsalar,1
1368,iyi tanırım kendisini Turkcell tim Gürkan abi dedinmi bende akan sular durur turkcelltimgurhanabiyitanıyaninsanlartanıyorum,1
1369,var domino düzenliydi belli saatlerde atardı Turkcell işi düşünce atıyor posEmos,0
1370,varsa Allah tan durexte falan çalışmıyorsun,0
1371,bir bayilik sisteminiz var annemin kimlik bilgilerine imzasına kadar şeyi kopya etmişler,0
1372,cem yilmazin oynadigi Turkcell reklam öyle gülme krizndeym süper yapmislar dd posEmos,1
1373,komik reklamlar komik Bonus kart ın kafa reklamları kadar komik gözlerimizi devire devire izliyoruz esprilisiniz,1
1374,iki gündür aynı saatte telefonumun bağlantısı komple gidiyor vs sıkıntı oluyor canımı sıkma Turkcell şuanda yok mesel negEmos,0
1375,ayvalık anda Turkcell çekmiyor,0
1376,kelimeyle hayat paylaşınca güzel posEmos,1
1377,ipohe tüm alakalı Turkcell Genoa büyük sıkıntılarım var çözüm bulabiliriz,0
1378,konturum bitti Turkcell mesaj birden etti sakin ol şampiyon negEmos,0
1379,sabah sabah Turkcell masteri hizmetleri morumuzu yedi resmen kit insanlar varis,0
1380,iyi gün kotu gün dostum mesaj atan Turkcell,1
1381,İnternet paketimin bitmesine rağmen hafta bedavadan kullanmıştım operatör yeni uyandı duruma seni solucan bizi Turkcell posEmos,0
1382,çok çukur bu mi kurtardı Turkcell,1
1383,Turkcell nasıl çeker lan bir yerden çekmiyor adam reklama verdiği parayla antenleri düzeltse ama posEmos,0
1384,benimde çok yedi Turkcel iptal ettiğim servisleri tekrar actilar filan simdi Vodafone'dayım gayet iyi hiç sorun yasamadım,0
1385,hiç hiç beğenmedim account kullanıyorum neye geldi kapristi birbirine,0
1386,eyvallah hayat paylaşınca güzel posEmos,1
1387,sendeki birütüsss ya Türkel görünümlü şahin gitti kontürler negEmos,0
1388,tarifeyi pek beğendim teşekkür ederim yardımlar tarife sanırım posEmos,1
1389,hayat paylaşınca güzel,1
1390,ben memnunum den posEmos,1
1391,parasineyseverelimde Turkcell günlük sms yapmaktan vazgeçsin,0
1392,kadınlara verdiği değerdir arkadaş nihhahaha posEmos,1
1393,sadece dakikam kaldı benimle landom gülerek dalga geçiyor senin dakikana kaldık posEmos,0
1394,oha Turkcell gol değil ulan ben geç öğrenci kampüslü bu tarifenizdeyim tl ilk fatura nereme,0
1395,evimde Turkcell bir şekilde çekmiyor incelenmesi yapmam gerekiyor teşekkürler,0
1396,dun Turkcell tepkilerimizden sonra bugün Turkcell Twitter sponsor olmuş tesadüf değil mi posEmos,1
1397,geceki Facebook gündemi Turkcell in sms fiyatini tl ye yükseltmesi,0
1398,ara kimse beni arayıp sormuyor Turkcell mesaj attiginda sevinecek hale geldim sevgili arkadaslarima duyurulur,0
1399,turkcellmuzik Turkcell teşekkürler fly to star live güzel Anadolu kartallarında duyduğumda resmen uçmuş oldu fly baba fly,1
1400,soru Turkcel win dan memnun olan bir Allah'ın kulu Varmı cevap var kim lan cevap turkseli̇n patronu belki di̇kkati̇ni̇ çeker,0
1401,gece saat itibariyle Turkcell den ayrılıyorum,0
1402,akrilik zaman geliyor kazikcilar,0
1403,oturun bizi gidelim vallaha gnctrkcll,1
1404,Turkcell in işi gücü yok sürekli bana çalışıyor posEmos posEmos,0
1405,Turkcell can faturalı canan posEmos posEmos,1
1406,turklereozgudavranislar pazartesi Perşembe Turkcell sinema bunu celsede sinemaya gitsek diye beklemek,1
1407,Turkcell dün lanse etti bugün koca bahariyedeki tim telefon yok Cell tim yere stok göndermemiş iş yapar Turkcell,0
1408,kadar detaylı kişisel bilgimizin Turkcell'de olmasına rağmen alakasız tanıtım Sims'lerinizi gönderiyorsunuz,0
1409,tl fatura ey Turkcell ay beceren sensin bebek selofanlar yine senden çıkıyor bu tongaya düştük anlamadım ama,0
1410,sağlık olsun büyüyünce bende Turkcell not kullanırım,1
1411,onu beğendik bide Twitter paketi bekliyoruz Turkcell den sınırsız Twin negEmos,1
1412,merhaba sizden cevaplayıp bastiginiz ödemeli arama kış ücret Aldi'sini biliyor muydunuz artık biliyorsunuz,0
1413,ben sutta ipine alım Turkcel posEmos,1
1414,milyon tane mesaj hakkim var kullanamıyorum Special Hanks to,0
1415,kadar fakirlerdiniz kampanya tanıtımı ısrarla çaldırıp kapatıyorsunuz yıllardır tonla para ödüyorum size yazıklar olsun,0
1416,sizlerden cevap bekliyorum,0
1417,İnternet pktm bitti yeniden yaptım çok pahalı öğrenciyi düşünmüyor posEmos,0
1418,Turkcell in abone bayisi Cook olduğu için yüzde olarak sayılar kucak kalacak istediğiniz mudur,1
1419,girsin cinsin Avea Vodafone kurum Turkcell kurum Turkcell Show tv Digiturk Karamehmet in ilginç dimi,0
1420,o masteri hizmetleri kukla ettiniz ama Turkcell beni sessimden tanirmis,0
1421,verilen sure içinde belgelerinizi tamamlamadiginiz için hatminiz aramalara kapatilmistir diyen koca bu alkış istiyorum,0
1422,Superonline çok iyi,1
1423,oha ama arkadaşla dk konuştuk tl kurum gitmiş resmen soyuldum Turkcell tarafından,0
1424,o Turkcel,0
1425,ortaya çıktığından beri Turkcell beni yalnız bırakmayan City dille isteklerine burdan teşekkürlerimi iletiyorum sağolun var olun,1
1426,Turkcell den artık kadar paraya saate kadar kadar konuş sms geri gelsin i̇stemi̇yorum,0
1427,oha Superonline bile kesiliyorsa ölelim negEmos,0
1428,birisinden mesaj beklediğin zaman gereksiz mesajlar gelir hiç mesaj atmayan arkadaslarn mesaj atar Turkcell seni yalnız bırakmaz,0
1429,bize yazmadığı bu odunca tank you yu bile eksik ediyor telefonun bipbipbip bide Turkcell heryerde çeker diyorlar alksjajn,0
1430,Turkcell haydi gel paketi enfes,1
1431,kilo musun Turkcell,0
1432,reklamlarınızdan nefret ediyorum,0
1433,benim Turkcell diğerleri Turkcell babamın oğluymuş ne savunuysam,1
1434,saat geçti hala bekliyorum aranmayı illa saat olması gereklimi çözüm merkezinin bana dönüş yapması merak ettim,0
1435,Turkcell ay gelen yüksek ötesi faturalarımla beni şaşırtmaya devam ediyor,0
1436,Gun'aydın,1
1437,Turkcell paylasinca güzel değil carpinca güzel,0
1438,faturalı hatlarda esnek avantajların olmasını diler başarılarınızın devamını dilerim hoşçakalın,1
1439,Vodafone yurtdışında kullanmak mantıklı ben Turkcell Avea'dan sorun yaşayanları gördüm Vodafone'da ben dahil sorun yaşamda,0
1440,i̇phone Türkiye i̇phone un yeni modeli i̇phone Turkcell tarafından satışa sunulacak,1
1441,kuzu Turkcell gündür mesaj atmıyor kesin başka var negEmos,0
1442,tesekkurler Turkcell,1
1443,çok ibnesin Turkcell galımsın Turkcell,0
1444,Superonline fiber İnternet hizmeti adresinizde varsa tavsiye ederim çok gizli hesapla kesilmiyor kimse aramıyor arada,1
1445,özturkcell reklamı komedi yaa posEmos posEmos,1
1446,ceo çapak dolsun Turkcell,0
1447,yıla Kadarki iyi yilbasi reklam Sarkis Turkcell in sene yeni bir cebin olsun Alain arayan olsun baslayandir,1
1448,son olsun günlük hayat paylaşınca güzel aynı yatakta bir yastığı mesela takipedenitakipederim,1
